{
  "kind": "security-result",
  "schemaVersion": 1,
  "status": "PASS",
  "reasons": [
    {
      "code": "SECURITY_CRITERIA_HELD",
      "message": "3 file(s); no secret found"
    }
  ],
  "app": {
    "appAlias": "hr"
  },
  "context": {
    "task": "T-42",
    "repo": {
      "commit": "0123456789abcdef0123456789abcdef01234567",
      "dirty": false
    },
    "frameworkVersion": "0.6.1",
    "timestamp": "2026-10-11T13:20:00Z",
    "producer": {
      "skill": "apex-security",
      "method": "tool"
    }
  },
  "scope": "secrets",
  "files": [
    "apex-sync.json",
    "db/hr/02-pkg_employees.sql",
    "apex/apexlang/hr/application.apx"
  ],
  "unparsed": [],
  "criteria": [
    {
      "id": "SEC-NO-SECRETS",
      "status": "PASS",
      "findings": []
    }
  ],
  "advisories": []
}