{
  "kind": "security-result",
  "schemaVersion": 1,
  "status": "PASS",
  "reasons": [
    {
      "code": "SECURITY_CRITERIA_HELD",
      "message": "4 file(s); no unbound dynamic SQL"
    }
  ],
  "app": {
    "appAlias": "hr"
  },
  "context": {
    "task": "T-42",
    "repo": {
      "commit": "0123456789abcdef0123456789abcdef01234567",
      "dirty": false
    },
    "frameworkVersion": "0.6.1",
    "timestamp": "2026-10-11T13:00:00Z",
    "producer": {
      "skill": "apex-security",
      "method": "tool"
    }
  },
  "scope": "plsql",
  "files": [
    "db/hr/01-ddl.sql",
    "db/hr/02-pkg_employees.sql",
    "db/hr/03-page-employee-form.apx",
    "db/hr/04-page-employee-drawer.apx"
  ],
  "unparsed": [],
  "criteria": [
    {
      "id": "SEC-SQL-BIND",
      "status": "PASS",
      "findings": []
    }
  ],
  "advisories": []
}